{
  "schemaVersion": 1,
  "slug": "chrome-mox",
  "name": "Chrome Mox",
  "oracleId": "ec3d4466-547c-4e02-b1b5-a156ec4637e9",
  "manaCost": "{0}",
  "cmc": 0,
  "colors": [],
  "colorIdentity": [],
  "typeLine": "Artifact",
  "types": [
    "Artifact"
  ],
  "subtypes": [],
  "oracleText": "Imprint — When this artifact enters, you may exile a nonartifact, nonland card from your hand.\n{T}: Add one mana of any of the exiled card's colors.",
  "keywords": [
    "Imprint"
  ],
  "isLand": false,
  "producesColors": [
    "B",
    "G",
    "R",
    "U",
    "W"
  ],
  "image": {
    "url": "https://assets.cubecobra.com/cardimages/90bbc0fa-4810-490d-bda7-a8fd4aaa01c4/normal.webp",
    "localPath": "data/cards/images/cards/chrome-mox.jpg",
    "artCropUrl": "https://assets.cubecobra.com/cardimages/90bbc0fa-4810-490d-bda7-a8fd4aaa01c4/art_crop.webp",
    "localArtPath": "data/cards/images/art/chrome-mox.jpg"
  },
  "imageUrl": "https://assets.cubecobra.com/cardimages/90bbc0fa-4810-490d-bda7-a8fd4aaa01c4/normal.webp",
  "powerScore": {
    "score": 28,
    "source": "untapped",
    "rawSourceScore": 28,
    "harmonizationDegree": "native",
    "confidence": 1,
    "updatedAt": "2026-09-09T14:38:54.229Z"
  },
  "presentInCubes": [
    "nico_candyshop"
  ],
  "objectiveAnalysis": {
    "summary": "Carte Vintage sélectionnée pour le Candyshop de Fedor (Score : 46.0).",
    "roles": [
      "mana_ramp",
      "premium_removal"
    ],
    "floorRating": 7.1,
    "ceilingRating": 8.8,
    "tempoImpact": "high",
    "quadrantStrengths": {
      "opening": 4.8,
      "developing": 4.9,
      "parity": 3.8,
      "behind": 4.2
    }
  },
  "cubeAnalyses": {
    "nico_candyshop": {
      "cubeKey": "nico_candyshop",
      "fit": "support",
      "tier": "B",
      "archetypes": [],
      "synergyTags": [
        "moxen",
        "mana-rock",
        "mana-producer"
      ],
      "scoreModifier": 0,
      "analysis": "Sélectionné pour le Vintage Candyshop Cube de Fedor. Carte d'impact majeur sur le Tour Fondamental (T1-T3).",
      "pedagogy": {
        "howToPlay": "Prioriser sur courbe pour accélérer ou neutraliser les sorties explosives adverses.",
        "archetypeFit": [
          {
            "colors": [
              "W"
            ],
            "archetype": "STORM COMBO",
            "grade": "A",
            "winrateOrScore": "Score 26.0",
            "comment": "Alignement Vintage compétitif."
          }
        ]
      },
      "relativeTier": "B",
      "metaBonus": 0,
      "metaRole": "neutral"
    }
  }
}
