{
  "schemaVersion": 1,
  "slug": "true-name-nemesis",
  "name": "True-Name Nemesis",
  "oracleId": "112322ad-8f66-4cd4-98a1-f425d61a69ce",
  "scryfallId": "e8c81cf6-e204-4fea-aaa1-4277366b31c7",
  "manaCost": "{U}{U}{1}",
  "cmc": 3,
  "colors": [
    "U"
  ],
  "colorIdentity": [
    "U"
  ],
  "typeLine": "Creature — Merfolk Rogue",
  "types": [
    "Creature"
  ],
  "subtypes": [
    "Merfolk",
    "Rogue"
  ],
  "oracleText": "As this creature enters, choose a player.\nThis creature has protection from the chosen player.",
  "keywords": [],
  "power": "3",
  "toughness": "1",
  "isLand": false,
  "producesColors": [],
  "image": {
    "url": "https://assets.cubecobra.com/cardimages/e8c81cf6-e204-4fea-aaa1-4277366b31c7/normal.webp",
    "localPath": "data/cards/images/true-name-nemesis.jpg",
    "artCropUrl": "https://assets.cubecobra.com/cardimages/e8c81cf6-e204-4fea-aaa1-4277366b31c7/art_crop.webp"
  },
  "imageUrl": "https://assets.cubecobra.com/cardimages/e8c81cf6-e204-4fea-aaa1-4277366b31c7/normal.webp",
  "powerScore": {
    "score": 27.8,
    "source": "expert_heuristic",
    "rawSourceScore": 27.8,
    "harmonizationDegree": "calibrated_medium",
    "confidence": 0.6,
    "updatedAt": "2026-09-06T00:00:00.000Z"
  },
  "presentInCubes": [
    "cedric_cube"
  ],
  "objectiveAnalysis": {
    "summary": "Carte High-Power sélectionnée pour le Cube de Cédric (Score : 28.3).",
    "roles": [
      "bomb"
    ],
    "floorRating": 4.4,
    "ceilingRating": 5.4,
    "tempoImpact": "high",
    "quadrantStrengths": {
      "opening": 3.8,
      "developing": 4.1,
      "parity": 3.9,
      "behind": 3.4
    }
  },
  "cubeAnalyses": {
    "cedric_cube": {
      "cubeKey": "cedric_cube",
      "fit": "support",
      "tier": "B+",
      "archetypes": [
        "cedric:high_power_staple",
        "cedric:dimir_tempo"
      ],
      "synergyTags": [
        "unique-protection",
        "color-break",
        "unique-evasion"
      ],
      "scoreModifier": 4,
      "analysis": "Sélectionné pour le High-Power Cube de Cédric (Strobinellus). Carte d'impact majeur sur le Tour Pivot (T3.5 - T4).",
      "pedagogy": {
        "howToPlay": "Prioriser sur courbe pour développer des menaces résilientes ou interagir efficacement sur le tour 3-4.",
        "archetypeFit": [
          {
            "colors": [
              "U"
            ],
            "archetype": "HIGH POWER STAPLE",
            "grade": "A",
            "winrateOrScore": "Score 27.8",
            "comment": "Pilier compétitif du cube de Cédric."
          }
        ]
      },
      "relativeTier": "B+",
      "metaBonus": 4,
      "metaRole": "support"
    }
  }
}
