{
  "schemaVersion": 1,
  "slug": "winds-of-abandon",
  "name": "Winds of Abandon",
  "oracleId": "499a4715-6776-461b-bee4-22ed172d455e",
  "manaCost": "{W}{1}",
  "cmc": 2,
  "colors": [
    "W"
  ],
  "colorIdentity": [
    "W"
  ],
  "typeLine": "Sorcery",
  "types": [
    "Sorcery"
  ],
  "subtypes": [],
  "oracleText": "Exile target creature you don't control. For each creature exiled this way, its controller searches their library for a basic land card. Those players put those cards onto the battlefield tapped, then shuffle.\nOverload {4}{W}{W} (You may cast this spell for its overload cost. If you do, change \"target\" in its text to \"each.\")",
  "keywords": [
    "Overload"
  ],
  "isLand": false,
  "producesColors": [],
  "image": {
    "url": "https://assets.cubecobra.com/cardimages/3bb17913-fe4d-4acd-9b75-71f5a90f898b/normal.webp",
    "localPath": "data/cards/images/cards/winds-of-abandon.jpg",
    "artCropUrl": "https://assets.cubecobra.com/cardimages/3bb17913-fe4d-4acd-9b75-71f5a90f898b/art_crop.webp",
    "localArtPath": "data/cards/images/art/winds-of-abandon.jpg"
  },
  "imageUrl": "https://assets.cubecobra.com/cardimages/3bb17913-fe4d-4acd-9b75-71f5a90f898b/normal.webp",
  "powerScore": {
    "score": 18,
    "source": "untapped",
    "rawSourceScore": 18,
    "harmonizationDegree": "native",
    "confidence": 1,
    "updatedAt": "2026-09-06T00:00:00.000Z"
  },
  "presentInCubes": [
    "nico_candyshop",
    "cedric_cube"
  ],
  "objectiveAnalysis": {
    "summary": "Carte Vintage sélectionnée pour le Candyshop de Fedor (Score : 18.0).",
    "roles": [
      "premium_removal"
    ],
    "floorRating": 2.8,
    "ceilingRating": 3.4,
    "tempoImpact": "medium",
    "quadrantStrengths": {
      "opening": 4,
      "developing": 4.2,
      "parity": 3.8,
      "behind": 3.5
    }
  },
  "cubeAnalyses": {
    "nico_candyshop": {
      "cubeKey": "nico_candyshop",
      "fit": "support",
      "tier": "B",
      "archetypes": [
        "nico:vintage_staple"
      ],
      "synergyTags": [
        "drawback",
        "single-target-instant-sorcery",
        "sweeper-one-sided"
      ],
      "scoreModifier": 0,
      "analysis": "Sélectionné pour le Vintage Candyshop Cube de Fedor. Carte d'impact majeur sur le Tour Fondamental (T1-T3).",
      "pedagogy": {
        "howToPlay": "Prioriser sur courbe pour accélérer ou neutraliser les sorties explosives adverses.",
        "archetypeFit": [
          {
            "colors": [
              "W"
            ],
            "archetype": "VINTAGE STAPLE",
            "grade": "B",
            "winrateOrScore": "Score 18.0",
            "comment": "Alignement Vintage compétitif."
          }
        ]
      }
    },
    "cedric_cube": {
      "cubeKey": "cedric_cube",
      "fit": "support",
      "tier": "B",
      "archetypes": [
        "cedric:high_power_staple"
      ],
      "synergyTags": [
        "drawback",
        "single-target-instant-sorcery",
        "sweeper-one-sided"
      ],
      "scoreModifier": 0,
      "analysis": "Sélectionné pour le High-Power Cube de Cédric (Strobinellus). Carte d'impact majeur sur le Tour Pivot (T3.5 - T4).",
      "pedagogy": {
        "howToPlay": "Prioriser sur courbe pour développer des menaces résilientes ou interagir efficacement sur le tour 3-4.",
        "archetypeFit": [
          {
            "colors": [
              "W"
            ],
            "archetype": "HIGH POWER STAPLE",
            "grade": "B",
            "winrateOrScore": "Score 18.0",
            "comment": "Pilier compétitif du cube de Cédric."
          }
        ]
      }
    }
  }
}
