{
  "schemaVersion": 1,
  "slug": "borderland-marauder",
  "name": "Borderland Marauder",
  "oracleId": "11fd2650-2150-4e62-8b64-e820d734a231",
  "manaCost": "{R}{1}",
  "cmc": 2,
  "colors": [
    "R"
  ],
  "colorIdentity": [
    "R"
  ],
  "typeLine": "Creature — Human Warrior",
  "types": [
    "Creature"
  ],
  "subtypes": [
    "Human",
    "Warrior"
  ],
  "oracleText": "Whenever this creature attacks, it gets +2/+0 until end of turn.",
  "keywords": [],
  "power": "1",
  "toughness": "2",
  "isLand": false,
  "producesColors": [],
  "image": {
    "url": "https://assets.cubecobra.com/cardimages/12e29b2b-5fe3-4dee-b247-10cd139fe2d0/normal.webp",
    "localPath": "data/cards/images/cards/borderland-marauder.jpg",
    "artCropUrl": "https://assets.cubecobra.com/cardimages/12e29b2b-5fe3-4dee-b247-10cd139fe2d0/art_crop.webp",
    "localArtPath": "data/cards/images/art/borderland-marauder.jpg"
  },
  "imageUrl": "https://assets.cubecobra.com/cardimages/12e29b2b-5fe3-4dee-b247-10cd139fe2d0/normal.webp",
  "powerScore": {
    "score": 20,
    "source": "expert_heuristic",
    "rawSourceScore": 20,
    "harmonizationDegree": "calibrated_medium",
    "confidence": 0.6,
    "updatedAt": "2026-09-06T00:00:00.000Z"
  },
  "presentInCubes": [
    "hugues_pauper"
  ],
  "objectiveAnalysis": {
    "summary": "Carte commune sélectionnée pour le Pauper Cube de Hugues (Score : 19.4).",
    "roles": [
      "beater"
    ],
    "floorRating": 3,
    "ceilingRating": 3.7,
    "tempoImpact": "medium",
    "quadrantStrengths": {
      "opening": 3.8,
      "developing": 4,
      "parity": 3.5,
      "behind": 3.2
    }
  },
  "cubeAnalyses": {
    "hugues_pauper": {
      "cubeKey": "hugues_pauper",
      "fit": "support",
      "tier": "B",
      "archetypes": [
        "hugues:pauper_staple",
        "hugues:gruul_stompy",
        "hugues:red_deck_wins"
      ],
      "synergyTags": [
        "attacking-matters-self",
        "attack-trigger",
        "triggered-ability"
      ],
      "scoreModifier": 4,
      "analysis": "Sélectionné pour le Pauper Cube de Hugues. Pièce fondamentale valorisant le tempo et les échanges 2-pour-1 sur le Tour Pivot (T4-T5).",
      "pedagogy": {
        "howToPlay": "Optimiser les échanges de ressources et stabiliser la présence sur table vers le tour 4.",
        "archetypeFit": [
          {
            "colors": [
              "R"
            ],
            "archetype": "PAUPER STAPLE",
            "grade": "B",
            "winrateOrScore": "Score 20.0",
            "comment": "Pilier du métagame Pauper équilibré."
          }
        ]
      },
      "relativeTier": "B",
      "metaBonus": 4,
      "metaRole": "support"
    }
  },
  "frenchName": "Maraudeuse des frontières",
  "frenchText": "À chaque fois que la Maraudeuse des frontières attaque, elle gagne +2/+0 jusqu'à la fin du tour."
}
