{
  "schemaVersion": 1,
  "slug": "magister-of-worth",
  "name": "Magister of Worth",
  "oracleId": "0429d146-332f-4fb0-8273-c73679ca6d47",
  "scryfallId": "21739c08-054a-4ede-b551-de7de3f50bfe",
  "manaCost": "{B}{W}{4}",
  "cmc": 6,
  "colors": [
    "B",
    "W"
  ],
  "colorIdentity": [
    "B",
    "W"
  ],
  "typeLine": "Creature — Angel",
  "types": [
    "Creature"
  ],
  "subtypes": [
    "Angel"
  ],
  "oracleText": "Flying\nWill of the council — When this creature enters, starting with you, each player votes for grace or condemnation. If grace gets more votes, each player returns each creature card from their graveyard to the battlefield. If condemnation gets more votes or the vote is tied, destroy all creatures other than this creature.",
  "keywords": [
    "Flying",
    "Will of the council"
  ],
  "power": "4",
  "toughness": "4",
  "isLand": false,
  "producesColors": [],
  "image": {
    "url": "https://assets.cubecobra.com/cardimages/21739c08-054a-4ede-b551-de7de3f50bfe/normal.webp",
    "localPath": "data/cards/images/magister-of-worth.jpg",
    "artCropUrl": "https://assets.cubecobra.com/cardimages/21739c08-054a-4ede-b551-de7de3f50bfe/art_crop.webp"
  },
  "imageUrl": "https://assets.cubecobra.com/cardimages/21739c08-054a-4ede-b551-de7de3f50bfe/normal.webp",
  "powerScore": {
    "score": 22.8,
    "source": "expert_heuristic",
    "rawSourceScore": 22.8,
    "harmonizationDegree": "calibrated_medium",
    "confidence": 0.6,
    "updatedAt": "2026-09-06T00:00:00.000Z"
  },
  "presentInCubes": [
    "cedric_cube"
  ],
  "objectiveAnalysis": {
    "summary": "Carte High-Power sélectionnée pour le Cube de Cédric (Score : 22.8).",
    "roles": [
      "premium_removal"
    ],
    "floorRating": 3.4,
    "ceilingRating": 4.3,
    "tempoImpact": "medium",
    "quadrantStrengths": {
      "opening": 3.8,
      "developing": 4.1,
      "parity": 3.9,
      "behind": 3.4
    }
  },
  "cubeAnalyses": {
    "cedric_cube": {
      "cubeKey": "cedric_cube",
      "fit": "support",
      "tier": "B-",
      "archetypes": [
        "cedric:orzhov_attrition_tokens"
      ],
      "synergyTags": [
        "sweeper",
        "removal",
        "voting"
      ],
      "scoreModifier": 4,
      "analysis": "Sélectionné pour le High-Power Cube de Cédric (Strobinellus). Carte d'impact majeur sur le Tour Pivot (T3.5 - T4).",
      "pedagogy": {
        "howToPlay": "Prioriser sur courbe pour développer des menaces résilientes ou interagir efficacement sur le tour 3-4.",
        "archetypeFit": [
          {
            "colors": [
              "B",
              "W"
            ],
            "archetype": "DIMIR REANIMATOR",
            "grade": "B",
            "winrateOrScore": "Score 22.8",
            "comment": "Pilier compétitif du cube de Cédric."
          }
        ]
      },
      "relativeTier": "B-",
      "metaBonus": 4,
      "metaRole": "support"
    }
  }
}
