{
  "schemaVersion": 1,
  "slug": "hallowed-spiritkeeper",
  "name": "Hallowed Spiritkeeper",
  "oracleId": "5852ed2f-4332-4c30-b145-373deea471d9",
  "scryfallId": "94ebd5bd-99b3-4371-9ca2-e0504db1458e",
  "manaCost": "{W}{W}{1}",
  "cmc": 3,
  "colors": [
    "W"
  ],
  "colorIdentity": [
    "W"
  ],
  "typeLine": "Creature — Avatar",
  "types": [
    "Creature"
  ],
  "subtypes": [
    "Avatar"
  ],
  "oracleText": "Vigilance\nWhen this creature dies, create X 1/1 white Spirit creature tokens with flying, where X is the number of creature cards in your graveyard.",
  "keywords": [
    "Vigilance"
  ],
  "power": "3",
  "toughness": "2",
  "isLand": false,
  "producesColors": [],
  "image": {
    "url": "https://assets.cubecobra.com/cardimages/94ebd5bd-99b3-4371-9ca2-e0504db1458e/normal.webp",
    "localPath": "data/cards/images/hallowed-spiritkeeper.jpg",
    "artCropUrl": "https://assets.cubecobra.com/cardimages/94ebd5bd-99b3-4371-9ca2-e0504db1458e/art_crop.webp"
  },
  "imageUrl": "https://assets.cubecobra.com/cardimages/94ebd5bd-99b3-4371-9ca2-e0504db1458e/normal.webp",
  "powerScore": {
    "score": 16.5,
    "source": "expert_heuristic",
    "rawSourceScore": 16.5,
    "harmonizationDegree": "calibrated_medium",
    "confidence": 0.6,
    "updatedAt": "2026-09-06T00:00:00.000Z"
  },
  "presentInCubes": [
    "cedric_cube"
  ],
  "objectiveAnalysis": {
    "summary": "Carte High-Power sélectionnée pour le Cube de Cédric (Score : 16.3).",
    "roles": [
      "beater"
    ],
    "floorRating": 2.5,
    "ceilingRating": 3.1,
    "tempoImpact": "medium",
    "quadrantStrengths": {
      "opening": 3.8,
      "developing": 4.1,
      "parity": 3.9,
      "behind": 3.4
    }
  },
  "cubeAnalyses": {
    "cedric_cube": {
      "cubeKey": "cedric_cube",
      "fit": "filler",
      "tier": "F",
      "archetypes": [
        "cedric:selesnya_tokens_midrange"
      ],
      "synergyTags": [
        "undergrowth",
        "cards-in-graveyard-matter",
        "splits-on-death"
      ],
      "scoreModifier": 0,
      "analysis": "Sélectionné pour le High-Power Cube de Cédric (Strobinellus). Carte d'impact majeur sur le Tour Pivot (T3.5 - T4).",
      "pedagogy": {
        "howToPlay": "Prioriser sur courbe pour développer des menaces résilientes ou interagir efficacement sur le tour 3-4.",
        "archetypeFit": [
          {
            "colors": [
              "W"
            ],
            "archetype": "SELESNYA TOKENS MIDRANGE",
            "grade": "C",
            "winrateOrScore": "Score 16.5",
            "comment": "Pilier compétitif du cube de Cédric."
          }
        ]
      },
      "relativeTier": "F",
      "metaBonus": 0,
      "metaRole": "neutral"
    }
  }
}
