{
  "schemaVersion": 1,
  "slug": "baleful-strix",
  "name": "Baleful Strix",
  "oracleId": "37688720-03de-4eca-a82d-a0afe8d58adc",
  "manaCost": "{B}{U}",
  "cmc": 2,
  "colors": [
    "B",
    "U"
  ],
  "colorIdentity": [
    "B",
    "U"
  ],
  "typeLine": "Artifact Creature — Bird",
  "types": [
    "Artifact",
    "Creature"
  ],
  "subtypes": [
    "Bird"
  ],
  "oracleText": "Flying, deathtouch\nWhen this creature enters, draw a card.",
  "keywords": [
    "Deathtouch",
    "Flying"
  ],
  "power": "1",
  "toughness": "1",
  "isLand": false,
  "producesColors": [],
  "image": {
    "url": "https://assets.cubecobra.com/cardimages/679c1ac6-a015-45ec-a634-e665e377672b/normal.webp",
    "localPath": "data/cards/images/cards/baleful-strix.jpg",
    "artCropUrl": "https://assets.cubecobra.com/cardimages/679c1ac6-a015-45ec-a634-e665e377672b/art_crop.webp",
    "localArtPath": "data/cards/images/art/baleful-strix.jpg"
  },
  "imageUrl": "https://assets.cubecobra.com/cardimages/679c1ac6-a015-45ec-a634-e665e377672b/normal.webp",
  "powerScore": {
    "score": 42,
    "source": "untapped",
    "rawSourceScore": 42,
    "harmonizationDegree": "native",
    "confidence": 1,
    "updatedAt": "2026-09-15T21:17:13.920Z"
  },
  "presentInCubes": [
    "nico_candyshop",
    "cedric_cube"
  ],
  "objectiveAnalysis": {
    "summary": "Carte Vintage sélectionnée pour le Candyshop de Fedor (Score : 42.0).",
    "roles": [
      "card_advantage"
    ],
    "floorRating": 6.5,
    "ceilingRating": 8,
    "tempoImpact": "high",
    "quadrantStrengths": {
      "opening": 4,
      "developing": 4.2,
      "parity": 3.8,
      "behind": 3.5
    }
  },
  "cubeAnalyses": {
    "nico_candyshop": {
      "cubeKey": "nico_candyshop",
      "fit": "staple",
      "tier": "A",
      "archetypes": [
        "nico:blink",
        "nico:dimir_tempo"
      ],
      "synergyTags": [
        "cantrip",
        "pure-draw",
        "draw"
      ],
      "scoreModifier": 4,
      "analysis": "Sélectionné pour le Vintage Candyshop Cube de Fedor. Carte d'impact majeur sur le Tour Fondamental (T1-T3).",
      "pedagogy": {
        "howToPlay": "Prioriser sur courbe pour accélérer ou neutraliser les sorties explosives adverses.",
        "archetypeFit": [
          {
            "colors": [
              "B",
              "U"
            ],
            "archetype": "ARTIFACT RAMP",
            "grade": "S",
            "winrateOrScore": "Score 42.0",
            "comment": "Alignement Vintage compétitif."
          }
        ]
      },
      "relativeTier": "A",
      "metaBonus": 4,
      "metaRole": "support"
    },
    "cedric_cube": {
      "cubeKey": "cedric_cube",
      "fit": "staple",
      "tier": "A+",
      "archetypes": [
        "cedric:dimir_tempo"
      ],
      "synergyTags": [
        "cantrip",
        "pure-draw",
        "draw"
      ],
      "scoreModifier": 8,
      "analysis": "Sélectionné pour le High-Power Cube de Cédric (Strobinellus). Carte d'impact majeur sur le Tour Pivot (T3.5 - T4).",
      "pedagogy": {
        "howToPlay": "Prioriser sur courbe pour développer des menaces résilientes ou interagir efficacement sur le tour 3-4.",
        "archetypeFit": [
          {
            "colors": [
              "B",
              "U"
            ],
            "archetype": "DIMIR REANIMATOR",
            "grade": "S",
            "winrateOrScore": "Score 42.0",
            "comment": "Pilier compétitif du cube de Cédric."
          }
        ]
      },
      "relativeTier": "A+",
      "metaBonus": 8,
      "metaRole": "key"
    }
  }
}
