{
  "schemaVersion": 1,
  "slug": "daredevil-s-billy-club",
  "name": "Daredevil's Billy Club",
  "oracleId": "654db13d-c7e4-4ee0-a87a-3635467f2f19",
  "scryfallId": "7742bad6-cfba-4c06-b0a6-8c2a91a4ceb8",
  "manaCost": "{R}{1}",
  "cmc": 2,
  "colors": [
    "R"
  ],
  "colorIdentity": [
    "R"
  ],
  "typeLine": "Artifact — Equipment",
  "types": [
    "Artifact"
  ],
  "subtypes": [
    "Equipment"
  ],
  "oracleText": "When this Equipment enters, it deals 2 damage to any target and 1 damage to you.\nEquipped creature gets +1/+0 and has menace. (It can't be blocked except by two or more creatures.)\nEquip {2} ({2}: Attach to target creature you control. Equip only as a sorcery.)",
  "keywords": [
    "Equip"
  ],
  "isLand": false,
  "producesColors": [],
  "image": {
    "url": "https://assets.cubecobra.com/cardimages/7742bad6-cfba-4c06-b0a6-8c2a91a4ceb8/normal.webp",
    "localPath": "data/cards/images/daredevil-s-billy-club.jpg",
    "artCropUrl": "https://assets.cubecobra.com/cardimages/7742bad6-cfba-4c06-b0a6-8c2a91a4ceb8/art_crop.webp"
  },
  "imageUrl": "https://assets.cubecobra.com/cardimages/7742bad6-cfba-4c06-b0a6-8c2a91a4ceb8/normal.webp",
  "powerScore": {
    "score": 26.1,
    "source": "expert_heuristic",
    "rawSourceScore": 26.1,
    "harmonizationDegree": "fallback",
    "confidence": 0.5,
    "updatedAt": "2026-09-06T00:00:00.000Z"
  },
  "presentInCubes": [
    "titou_arena_peasant_plus"
  ],
  "objectiveAnalysis": {
    "summary": "Carte sélectionnée pour le Cube Titou Arena Peasant Plus (Score : 26.1).",
    "roles": [
      "premium_removal"
    ],
    "floorRating": 4,
    "ceilingRating": 5,
    "tempoImpact": "medium",
    "quadrantStrengths": {
      "opening": 3.8,
      "developing": 4,
      "parity": 3.9,
      "behind": 3.4
    }
  },
  "cubeAnalyses": {
    "titou_arena_peasant_plus": {
      "cubeKey": "titou_arena_peasant_plus",
      "fit": "support",
      "tier": "C+",
      "archetypes": [
        "titou_peasant:peasant_staple"
      ],
      "synergyTags": [
        "gives-menace",
        "gives-evasion",
        "triggered-ability"
      ],
      "scoreModifier": 0,
      "analysis": "Sélectionné pour le Titou Arena Peasant Plus Cube. Carte d'impact majeur sur le Tour Pivot (T3-T4).",
      "pedagogy": {
        "howToPlay": "Prioriser sur courbe pour développer votre plan de jeu ou interagir efficacement au tour 3-4.",
        "archetypeFit": [
          {
            "colors": [
              "R"
            ],
            "archetype": "PEASANT STAPLE",
            "grade": "A",
            "winrateOrScore": "Score 26.1",
            "comment": "Pièce de valeur pour l'environnement Titou Peasant Plus."
          }
        ]
      },
      "relativeTier": "C+",
      "metaBonus": 0,
      "metaRole": "neutral"
    }
  }
}
