{
  "schemaVersion": 1,
  "slug": "restless-cottage",
  "name": "Restless Cottage",
  "oracleId": "7e16595f-bdeb-422e-b99a-bfc0ed52e9f8",
  "manaCost": "",
  "cmc": 0,
  "colors": [],
  "colorIdentity": [
    "B",
    "G"
  ],
  "typeLine": "Land",
  "types": [
    "Land"
  ],
  "subtypes": [],
  "oracleText": "This land enters tapped.\n{T}: Add {B} or {G}.\n{2}{B}{G}: This land becomes a 4/4 black and green Horror creature until end of turn. It's still a land.\nWhenever this land attacks, create a Food token and exile up to one target card from a graveyard.",
  "keywords": [
    "Food"
  ],
  "isLand": true,
  "producesColors": [
    "B",
    "G"
  ],
  "image": {
    "url": "https://assets.cubecobra.com/cardimages/0dcb97ff-9356-4be7-8991-091f950c0b63/normal.webp",
    "localPath": "data/cards/images/cards/restless-cottage.jpg",
    "artCropUrl": "https://assets.cubecobra.com/cardimages/0dcb97ff-9356-4be7-8991-091f950c0b63/art_crop.webp",
    "localArtPath": "data/cards/images/art/restless-cottage.jpg"
  },
  "imageUrl": "https://assets.cubecobra.com/cardimages/0dcb97ff-9356-4be7-8991-091f950c0b63/normal.webp",
  "powerScore": {
    "score": 30,
    "source": "untapped",
    "rawSourceScore": 30,
    "harmonizationDegree": "native",
    "confidence": 1,
    "updatedAt": "2026-09-15T21:17:13.920Z"
  },
  "presentInCubes": [
    "nico_candyshop"
  ],
  "objectiveAnalysis": {
    "summary": "Carte Vintage sélectionnée pour le Candyshop de Fedor (Score : 34.0).",
    "roles": [
      "mana_ramp",
      "premium_removal"
    ],
    "floorRating": 5.3,
    "ceilingRating": 6.5,
    "tempoImpact": "medium",
    "quadrantStrengths": {
      "opening": 4,
      "developing": 4.2,
      "parity": 3.8,
      "behind": 3.5
    }
  },
  "cubeAnalyses": {
    "nico_candyshop": {
      "cubeKey": "nico_candyshop",
      "fit": "support",
      "tier": "B+",
      "archetypes": [],
      "synergyTags": [
        "repeatable-food",
        "repeatable-lifegain",
        "lifegain"
      ],
      "scoreModifier": 0,
      "analysis": "Sélectionné pour le Vintage Candyshop Cube de Fedor. Carte d'impact majeur sur le Tour Fondamental (T1-T3).",
      "pedagogy": {
        "howToPlay": "Prioriser sur courbe pour accélérer ou neutraliser les sorties explosives adverses.",
        "archetypeFit": [
          {
            "colors": [
              "W"
            ],
            "archetype": "STORM COMBO",
            "grade": "A",
            "winrateOrScore": "Score 34.0",
            "comment": "Alignement Vintage compétitif."
          }
        ]
      },
      "relativeTier": "B+",
      "metaBonus": 0,
      "metaRole": "neutral"
    }
  }
}
