{
  "schemaVersion": 1,
  "slug": "waterlogged-grove",
  "name": "Waterlogged Grove",
  "oracleId": "70fa2eba-565e-4fed-adc9-7f5d9fcbf1fa",
  "manaCost": "",
  "cmc": 0,
  "colors": [],
  "colorIdentity": [
    "G",
    "U"
  ],
  "typeLine": "Land",
  "types": [
    "Land"
  ],
  "subtypes": [],
  "oracleText": "{T}, Pay 1 life: Add {G} or {U}.\n{1}, {T}, Sacrifice this land: Draw a card.",
  "keywords": [],
  "isLand": true,
  "producesColors": [
    "G",
    "U"
  ],
  "image": {
    "url": "https://assets.cubecobra.com/cardimages/0ab6bfbd-d2e1-4c4c-9f91-6f69c5b8e3bb/normal.webp",
    "localPath": "data/cards/images/cards/waterlogged-grove.jpg",
    "artCropUrl": "https://assets.cubecobra.com/cardimages/0ab6bfbd-d2e1-4c4c-9f91-6f69c5b8e3bb/art_crop.webp",
    "localArtPath": "data/cards/images/art/waterlogged-grove.jpg"
  },
  "imageUrl": "https://assets.cubecobra.com/cardimages/0ab6bfbd-d2e1-4c4c-9f91-6f69c5b8e3bb/normal.webp",
  "powerScore": {
    "score": 23.9,
    "source": "expert_heuristic",
    "rawSourceScore": 23.9,
    "harmonizationDegree": "calibrated_medium",
    "confidence": 0.6,
    "updatedAt": "2026-09-06T00:00:00.000Z"
  },
  "presentInCubes": [
    "nico_candyshop"
  ],
  "objectiveAnalysis": {
    "summary": "Carte Vintage sélectionnée pour le Candyshop de Fedor (Score : 23.9).",
    "roles": [
      "mana_ramp",
      "card_advantage"
    ],
    "floorRating": 3.7,
    "ceilingRating": 4.6,
    "tempoImpact": "medium",
    "quadrantStrengths": {
      "opening": 4,
      "developing": 4.2,
      "parity": 3.8,
      "behind": 3.5
    }
  },
  "cubeAnalyses": {
    "nico_candyshop": {
      "cubeKey": "nico_candyshop",
      "fit": "support",
      "tier": "B-",
      "archetypes": [],
      "synergyTags": [
        "drawback",
        "pure-draw",
        "draw"
      ],
      "scoreModifier": 0,
      "analysis": "Sélectionné pour le Vintage Candyshop Cube de Fedor. Carte d'impact majeur sur le Tour Fondamental (T1-T3).",
      "pedagogy": {
        "howToPlay": "Prioriser sur courbe pour accélérer ou neutraliser les sorties explosives adverses.",
        "archetypeFit": [
          {
            "colors": [
              "W"
            ],
            "archetype": "STORM COMBO",
            "grade": "B",
            "winrateOrScore": "Score 23.9",
            "comment": "Alignement Vintage compétitif."
          }
        ]
      },
      "relativeTier": "B-",
      "metaBonus": 0,
      "metaRole": "neutral"
    }
  }
}
