{
  "schemaVersion": 1,
  "slug": "squall-drifter",
  "name": "Squall Drifter",
  "oracleId": "63ec5617-0da6-4534-b502-34304b1ea02b",
  "manaCost": "{W}{1}",
  "cmc": 2,
  "colors": [
    "W"
  ],
  "colorIdentity": [
    "W"
  ],
  "typeLine": "Snow Creature — Elemental",
  "types": [
    "Snow",
    "Creature"
  ],
  "subtypes": [
    "Elemental"
  ],
  "oracleText": "Flying\n{W}, {T}: Tap target creature.",
  "keywords": [
    "Flying"
  ],
  "power": "1",
  "toughness": "1",
  "isLand": false,
  "producesColors": [],
  "image": {
    "url": "https://assets.cubecobra.com/cardimages/b3ecb728-4b54-47d0-bbef-d39e5f7d172f/normal.webp",
    "localPath": "data/cards/images/cards/squall-drifter.jpg",
    "artCropUrl": "https://assets.cubecobra.com/cardimages/b3ecb728-4b54-47d0-bbef-d39e5f7d172f/art_crop.webp",
    "localArtPath": "data/cards/images/art/squall-drifter.jpg"
  },
  "imageUrl": "https://assets.cubecobra.com/cardimages/b3ecb728-4b54-47d0-bbef-d39e5f7d172f/normal.webp",
  "powerScore": {
    "score": 17.8,
    "source": "expert_heuristic",
    "rawSourceScore": 17.8,
    "harmonizationDegree": "calibrated_medium",
    "confidence": 0.6,
    "updatedAt": "2026-09-06T00:00:00.000Z"
  },
  "presentInCubes": [
    "hugues_pauper"
  ],
  "objectiveAnalysis": {
    "summary": "Carte commune sélectionnée pour le Pauper Cube de Hugues (Score : 17.8).",
    "roles": [
      "beater"
    ],
    "floorRating": 2.8,
    "ceilingRating": 3.4,
    "tempoImpact": "medium",
    "quadrantStrengths": {
      "opening": 3.8,
      "developing": 4,
      "parity": 3.5,
      "behind": 3.2
    }
  },
  "cubeAnalyses": {
    "hugues_pauper": {
      "cubeKey": "hugues_pauper",
      "fit": "support",
      "tier": "D+",
      "archetypes": [
        "hugues:pauper_staple",
        "hugues:white_weenie"
      ],
      "synergyTags": [
        "unique-type-line",
        "repeatable-crime",
        "tapper-creature"
      ],
      "scoreModifier": 4,
      "analysis": "Sélectionné pour le Pauper Cube de Hugues. Pièce fondamentale valorisant le tempo et les échanges 2-pour-1 sur le Tour Pivot (T4-T5).",
      "pedagogy": {
        "howToPlay": "Optimiser les échanges de ressources et stabiliser la présence sur table vers le tour 4.",
        "archetypeFit": [
          {
            "colors": [
              "W"
            ],
            "archetype": "PAUPER STAPLE",
            "grade": "B",
            "winrateOrScore": "Score 17.8",
            "comment": "Pilier du métagame Pauper équilibré."
          }
        ]
      },
      "relativeTier": "D+",
      "metaBonus": 4,
      "metaRole": "support"
    }
  },
  "frenchName": "Dériveur des bourrasques",
  "frenchText": "Vol\n{W}, {T} : Engagez la créature ciblée."
}
