{
  "schemaVersion": 1,
  "slug": "sever-the-bloodline",
  "name": "Sever the Bloodline",
  "oracleId": "b9019332-2f02-48d9-be0a-a2b41b79e136",
  "manaCost": "{3}{B}",
  "cmc": 4,
  "colors": [
    "B"
  ],
  "colorIdentity": [
    "B"
  ],
  "typeLine": "Sorcery",
  "types": [
    "Sorcery"
  ],
  "subtypes": [],
  "oracleText": "Exile target creature and all other creatures with the same name as that creature.\nFlashback {5}{B}{B} (You may cast this card from your graveyard for its flashback cost. Then exile it.)",
  "keywords": [
    "Flashback"
  ],
  "isLand": false,
  "producesColors": [],
  "image": {
    "url": "https://cards.scryfall.io/normal/front/a/2/a2d4152d-c128-453c-86f5-f2ebcfd48b98.jpg?1783908134",
    "localPath": "data/cards/images/cards/sever-the-bloodline.jpg",
    "artCropUrl": "https://cards.scryfall.io/art_crop/front/a/2/a2d4152d-c128-453c-86f5-f2ebcfd48b98.jpg?1783908134",
    "localArtPath": "data/cards/images/art/sever-the-bloodline.jpg",
    "localFrenchPath": "data/cards/images/fr/cards/sever-the-bloodline.jpg",
    "localFrenchArtPath": "data/cards/images/fr/art/sever-the-bloodline.jpg"
  },
  "imageUrl": "https://cards.scryfall.io/normal/front/a/2/a2d4152d-c128-453c-86f5-f2ebcfd48b98.jpg?1783908134",
  "powerScore": {
    "score": 18.3,
    "source": "expert_heuristic",
    "rawSourceScore": 18.3,
    "harmonizationDegree": "calibrated_medium",
    "confidence": 0.6,
    "updatedAt": "2026-09-06T00:00:00.000Z"
  },
  "presentInCubes": [
    "titou_tribal"
  ],
  "objectiveAnalysis": {
    "summary": "Sever the Bloodline est une carte solide offrant un bon tempo et une flexibilité appréciable.",
    "roles": [
      "synergy_enabler"
    ],
    "floorRating": 3.7,
    "ceilingRating": 4.5,
    "tempoImpact": "medium",
    "quadrantStrengths": {
      "opening": 3.5,
      "developing": 4,
      "parity": 3.8,
      "behind": 3
    }
  },
  "cubeAnalyses": {
    "titou_tribal": {
      "cubeKey": "titou_tribal",
      "fit": "support",
      "tier": "B",
      "archetypes": [],
      "synergyTags": [],
      "scoreModifier": 0,
      "analysis": "Carte de rang B (Score : 18.3) dans l'environnement tribal et interactif de Titou.",
      "pedagogy": {
        "howToPlay": "Jouez Sever the Bloodline sur courbe de mana pour consolider la présence sur table.",
        "archetypeFit": [
          {
            "colors": [
              "B"
            ],
            "archetype": "TRIBAL SYNERGY",
            "grade": "B",
            "winrateOrScore": "Score 18.3",
            "comment": "Alignement au métagame Titou Tribal (B)."
          }
        ]
      }
    }
  },
  "frenchName": "Interrompre la lignée",
  "frenchText": "Exilez une créature ciblée et toutes les autres créatures ayant le même nom que cette créature.\nFlashback {5}{B}{B} (Vous pouvez lancer cette carte depuis votre cimetière pour son coût de flashback. Exilez-la ensuite.)",
  "frenchImageUrl": "https://cards.scryfall.io/normal/front/1/4/143874e4-fc82-4a80-9003-84b3b67ebc39.jpg?1782858300",
  "localFrenchPath": "data/cards/images/fr/cards/sever-the-bloodline.jpg"
}
