{
  "schemaVersion": 1,
  "slug": "gran-gran",
  "name": "Gran-Gran",
  "oracleId": "0259a9ed-0558-4183-b737-871ed5573c32",
  "scryfallId": "fa434b41-e5f7-4989-865a-95db67b05cb1",
  "manaCost": "{U}",
  "cmc": 1,
  "colors": [
    "U"
  ],
  "colorIdentity": [
    "U"
  ],
  "typeLine": "Legendary Creature — Human Peasant Ally",
  "types": [
    "Legendary",
    "Creature"
  ],
  "subtypes": [
    "Human",
    "Peasant",
    "Ally"
  ],
  "oracleText": "Whenever Gran-Gran becomes tapped, draw a card, then discard a card.\nNoncreature spells you cast cost {1} less to cast as long as there are three or more Lesson cards in your graveyard.",
  "keywords": [],
  "power": "1",
  "toughness": "2",
  "isLand": false,
  "producesColors": [],
  "image": {
    "url": "https://assets.cubecobra.com/cardimages/fa434b41-e5f7-4989-865a-95db67b05cb1/normal.webp",
    "localPath": "data/cards/images/gran-gran.jpg",
    "artCropUrl": "https://assets.cubecobra.com/cardimages/fa434b41-e5f7-4989-865a-95db67b05cb1/art_crop.webp"
  },
  "imageUrl": "https://assets.cubecobra.com/cardimages/fa434b41-e5f7-4989-865a-95db67b05cb1/normal.webp",
  "powerScore": {
    "score": 28.7,
    "source": "expert_heuristic",
    "rawSourceScore": 28.7,
    "harmonizationDegree": "fallback",
    "confidence": 0.5,
    "updatedAt": "2026-09-06T00:00:00.000Z"
  },
  "presentInCubes": [
    "titou_arena_peasant_plus"
  ],
  "objectiveAnalysis": {
    "summary": "Carte sélectionnée pour le Cube Titou Arena Peasant Plus (Score : 28.7).",
    "roles": [
      "card_advantage"
    ],
    "floorRating": 4.4,
    "ceilingRating": 5.5,
    "tempoImpact": "high",
    "quadrantStrengths": {
      "opening": 3.8,
      "developing": 4,
      "parity": 3.9,
      "behind": 3.4
    }
  },
  "cubeAnalyses": {
    "titou_arena_peasant_plus": {
      "cubeKey": "titou_arena_peasant_plus",
      "fit": "support",
      "tier": "B",
      "archetypes": [
        "titou_peasant:peasant_staple",
        "titou_peasant:izzet_artifacts"
      ],
      "synergyTags": [
        "uninspired",
        "triggered-ability",
        "cards-in-graveyard-matter"
      ],
      "scoreModifier": 8,
      "analysis": "Sélectionné pour le Titou Arena Peasant Plus Cube. Carte d'impact majeur sur le Tour Pivot (T3-T4).",
      "pedagogy": {
        "howToPlay": "Prioriser sur courbe pour développer votre plan de jeu ou interagir efficacement au tour 3-4.",
        "archetypeFit": [
          {
            "colors": [
              "U"
            ],
            "archetype": "PEASANT STAPLE",
            "grade": "A",
            "winrateOrScore": "Score 28.7",
            "comment": "Pièce de valeur pour l'environnement Titou Peasant Plus."
          }
        ]
      },
      "relativeTier": "B",
      "metaBonus": 8,
      "metaRole": "key"
    }
  }
}
