{
  "schemaVersion": 1,
  "slug": "kethis-the-hidden-hand",
  "name": "Kethis, the Hidden Hand",
  "oracleId": "1bf08ba0-4235-4dea-9722-ed991a3b6044",
  "manaCost": "{W}{B}{G}",
  "cmc": 3,
  "colors": [
    "B",
    "G",
    "W"
  ],
  "colorIdentity": [
    "B",
    "G",
    "W"
  ],
  "typeLine": "Legendary Creature — Elf Advisor",
  "types": [
    "Creature"
  ],
  "subtypes": [
    "Elf",
    "Advisor"
  ],
  "oracleText": "Legendary spells you cast cost {1} less to cast.\nExile two legendary cards from your graveyard: Until end of turn, each legendary card in your graveyard gains \"You may play this card from your graveyard.\"",
  "keywords": [],
  "isLand": false,
  "producesColors": [],
  "image": {
    "url": "https://cards.scryfall.io/normal/front/f/e/fe28de73-76f3-4a9e-a020-dbe5921b9be5.jpg?1783932951",
    "localPath": "data/cards/images/cards/kethis-the-hidden-hand.jpg",
    "artCropUrl": "https://cards.scryfall.io/art_crop/front/f/e/fe28de73-76f3-4a9e-a020-dbe5921b9be5.jpg?1783932951",
    "localArtPath": "data/cards/images/art/kethis-the-hidden-hand.jpg",
    "localFrenchPath": "data/cards/images/fr/cards/kethis-the-hidden-hand.jpg",
    "localFrenchArtPath": "data/cards/images/fr/art/kethis-the-hidden-hand.jpg"
  },
  "imageUrl": "https://cards.scryfall.io/normal/front/f/e/fe28de73-76f3-4a9e-a020-dbe5921b9be5.jpg?1783932951",
  "powerScore": {
    "score": 16.9,
    "source": "expert_heuristic",
    "rawSourceScore": 16.9,
    "harmonizationDegree": "calibrated_medium",
    "confidence": 0.6,
    "updatedAt": "2026-09-06T00:00:00.000Z"
  },
  "presentInCubes": [
    "titou_tribal"
  ],
  "objectiveAnalysis": {
    "summary": "Kethis, the Hidden Hand est une carte solide offrant un bon tempo et une flexibilité appréciable.",
    "roles": [
      "synergy_enabler"
    ],
    "floorRating": 3.7,
    "ceilingRating": 4.5,
    "tempoImpact": "medium",
    "quadrantStrengths": {
      "opening": 3.5,
      "developing": 4,
      "parity": 3.8,
      "behind": 3
    }
  },
  "cubeAnalyses": {
    "titou_tribal": {
      "cubeKey": "titou_tribal",
      "fit": "filler",
      "tier": "F",
      "archetypes": [
        "titou:chromatic_legends",
        "titou:tribal_elves"
      ],
      "synergyTags": [],
      "scoreModifier": 4,
      "analysis": "Carte de rang C (Score : 16.9) dans l'environnement tribal et interactif de Titou.",
      "pedagogy": {
        "howToPlay": "Jouez Kethis, the Hidden Hand sur courbe de mana pour consolider la présence sur table.",
        "archetypeFit": [
          {
            "colors": [
              "B",
              "G",
              "W"
            ],
            "archetype": "TRIBAL SYNERGY",
            "grade": "C",
            "winrateOrScore": "Score 16.9",
            "comment": "Alignement au métagame Titou Tribal (C)."
          }
        ]
      },
      "relativeTier": "F",
      "metaBonus": 4,
      "metaRole": "support"
    }
  },
  "frenchName": "Kethis, la main cachée",
  "frenchText": "Les sorts légendaires que vous lancez coûtent {1} de moins à lancer.\nExilez deux cartes légendaires de votre cimetière : Jusqu'à la fin du tour, chaque carte légendaire de votre cimetière acquiert « Vous pouvez jouer cette carte depuis votre cimetière. »",
  "frenchImageUrl": "https://cards.scryfall.io/normal/front/f/0/f09d2ec5-2e5b-49cb-a80b-db726631c767.jpg?1782916783",
  "localFrenchPath": "data/cards/images/fr/cards/kethis-the-hidden-hand.jpg"
}
