{
  "schemaVersion": 1,
  "slug": "warleader-s-helix",
  "name": "Warleader's Helix",
  "oracleId": "b1ea88f5-162b-4f08-bec3-be1f06dec392",
  "scryfallId": "fcc1dd23-90fa-4aa4-b0a9-7a92991ad7ec",
  "manaCost": "{W}{R}{2}",
  "cmc": 4,
  "colors": [
    "R",
    "W"
  ],
  "colorIdentity": [
    "R",
    "W"
  ],
  "typeLine": "Instant",
  "types": [
    "Instant"
  ],
  "subtypes": [],
  "oracleText": "Warleader's Helix deals 4 damage to any target and you gain 4 life.",
  "keywords": [],
  "isLand": false,
  "producesColors": [],
  "image": {
    "url": "https://assets.cubecobra.com/cardimages/fcc1dd23-90fa-4aa4-b0a9-7a92991ad7ec/normal.webp",
    "localPath": "data/cards/images/warleader-s-helix.jpg",
    "artCropUrl": "https://assets.cubecobra.com/cardimages/fcc1dd23-90fa-4aa4-b0a9-7a92991ad7ec/art_crop.webp"
  },
  "imageUrl": "https://assets.cubecobra.com/cardimages/fcc1dd23-90fa-4aa4-b0a9-7a92991ad7ec/normal.webp",
  "powerScore": {
    "score": 18.7,
    "source": "expert_heuristic",
    "rawSourceScore": 18.7,
    "harmonizationDegree": "calibrated_medium",
    "confidence": 0.6,
    "updatedAt": "2026-09-06T00:00:00.000Z"
  },
  "presentInCubes": [
    "cedric_cube"
  ],
  "objectiveAnalysis": {
    "summary": "Carte High-Power sélectionnée pour le Cube de Cédric (Score : 18.3).",
    "roles": [
      "premium_removal"
    ],
    "floorRating": 2.8,
    "ceilingRating": 3.5,
    "tempoImpact": "medium",
    "quadrantStrengths": {
      "opening": 3.8,
      "developing": 4.1,
      "parity": 3.9,
      "behind": 3.4
    }
  },
  "cubeAnalyses": {
    "cedric_cube": {
      "cubeKey": "cedric_cube",
      "fit": "support",
      "tier": "D",
      "archetypes": [
        "cedric:boros_aggro_equipment"
      ],
      "synergyTags": [
        "single-target-instant-sorcery",
        "spot-removal",
        "removal"
      ],
      "scoreModifier": 0,
      "analysis": "Sélectionné pour le High-Power Cube de Cédric (Strobinellus). Carte d'impact majeur sur le Tour Pivot (T3.5 - T4).",
      "pedagogy": {
        "howToPlay": "Prioriser sur courbe pour développer des menaces résilientes ou interagir efficacement sur le tour 3-4.",
        "archetypeFit": [
          {
            "colors": [
              "R",
              "W"
            ],
            "archetype": "BOROS AGGRO EQUIPMENT",
            "grade": "B",
            "winrateOrScore": "Score 18.7",
            "comment": "Pilier compétitif du cube de Cédric."
          }
        ]
      },
      "relativeTier": "D",
      "metaBonus": 0,
      "metaRole": "neutral"
    }
  }
}
