{
  "schemaVersion": 1,
  "slug": "spider-manifestation",
  "name": "Spider Manifestation",
  "oracleId": "8281f2b9-e81b-48da-812a-8713b2adf8ab",
  "scryfallId": "99223677-b8a5-48f1-8009-e8475eada7db",
  "manaCost": "{R-G}{1}",
  "cmc": 2,
  "colors": [
    "G",
    "R"
  ],
  "colorIdentity": [
    "G",
    "R"
  ],
  "typeLine": "Creature — Spider Avatar",
  "types": [
    "Creature"
  ],
  "subtypes": [
    "Spider",
    "Avatar"
  ],
  "oracleText": "Reach\n{T}: Add {R} or {G}.\nWhenever you cast a spell with mana value 4 or greater, untap this creature.",
  "keywords": [
    "Reach"
  ],
  "power": "2",
  "toughness": "2",
  "isLand": false,
  "producesColors": [
    "G",
    "R"
  ],
  "image": {
    "url": "https://assets.cubecobra.com/cardimages/99223677-b8a5-48f1-8009-e8475eada7db/normal.webp",
    "localPath": "data/cards/images/spider-manifestation.jpg",
    "artCropUrl": "https://assets.cubecobra.com/cardimages/99223677-b8a5-48f1-8009-e8475eada7db/art_crop.webp"
  },
  "imageUrl": "https://assets.cubecobra.com/cardimages/99223677-b8a5-48f1-8009-e8475eada7db/normal.webp",
  "powerScore": {
    "score": 33.7,
    "source": "expert_heuristic",
    "rawSourceScore": 33.7,
    "harmonizationDegree": "fallback",
    "confidence": 0.5,
    "updatedAt": "2026-09-06T00:00:00.000Z"
  },
  "presentInCubes": [
    "titou_arena_peasant_plus"
  ],
  "objectiveAnalysis": {
    "summary": "Carte sélectionnée pour le Cube Titou Arena Peasant Plus (Score : 33.7).",
    "roles": [
      "mana_ramp"
    ],
    "floorRating": 5.2,
    "ceilingRating": 6.4,
    "tempoImpact": "high",
    "quadrantStrengths": {
      "opening": 3.8,
      "developing": 4,
      "parity": 3.9,
      "behind": 3.4
    }
  },
  "cubeAnalyses": {
    "titou_arena_peasant_plus": {
      "cubeKey": "titou_arena_peasant_plus",
      "fit": "support",
      "tier": "A",
      "archetypes": [
        "titou_peasant:gruul_stompy"
      ],
      "synergyTags": [
        "high-mana-value-matters",
        "mana-value-matters",
        "unique-type-line"
      ],
      "scoreModifier": 8,
      "analysis": "Sélectionné pour le Titou Arena Peasant Plus Cube. Carte d'impact majeur sur le Tour Pivot (T3-T4).",
      "pedagogy": {
        "howToPlay": "Prioriser sur courbe pour développer votre plan de jeu ou interagir efficacement au tour 3-4.",
        "archetypeFit": [
          {
            "colors": [
              "G",
              "R"
            ],
            "archetype": "GRUUL STOMPY",
            "grade": "A",
            "winrateOrScore": "Score 33.7",
            "comment": "Pièce de valeur pour l'environnement Titou Peasant Plus."
          }
        ]
      },
      "relativeTier": "A",
      "metaBonus": 8,
      "metaRole": "key"
    }
  }
}
