{
  "schemaVersion": 1,
  "slug": "guide-of-souls",
  "name": "Guide of Souls",
  "oracleId": "b304ac72-7f40-40de-b8d6-6392909b6029",
  "manaCost": "{W}",
  "cmc": 1,
  "colors": [
    "W"
  ],
  "colorIdentity": [
    "W"
  ],
  "typeLine": "Creature — Human Cleric",
  "types": [
    "Creature"
  ],
  "subtypes": [
    "Human",
    "Cleric"
  ],
  "oracleText": "Whenever another creature you control enters, you gain 1 life and get {E} (an energy counter).\nWhenever you attack, you may pay {E}{E}{E}. When you do, put two +1/+1 counters and a flying counter on target attacking creature. It becomes an Angel in addition to its other types.",
  "keywords": [],
  "isLand": false,
  "producesColors": [],
  "image": {
    "url": "https://cards.scryfall.io/normal/front/7/6/76c3cad2-1e25-4abe-878d-9194de6fcc27.jpg?1783911300",
    "localPath": "data/cards/images/cards/guide-of-souls.jpg",
    "artCropUrl": "https://cards.scryfall.io/art_crop/front/7/6/76c3cad2-1e25-4abe-878d-9194de6fcc27.jpg?1783911300",
    "localArtPath": "data/cards/images/art/guide-of-souls.jpg",
    "localFrenchPath": "data/cards/images/fr/cards/guide-of-souls.jpg",
    "localFrenchArtPath": "data/cards/images/fr/art/guide-of-souls.jpg"
  },
  "imageUrl": "https://cards.scryfall.io/normal/front/7/6/76c3cad2-1e25-4abe-878d-9194de6fcc27.jpg?1783911300",
  "powerScore": {
    "score": 44,
    "source": "untapped",
    "rawSourceScore": 44,
    "harmonizationDegree": "native",
    "confidence": 1,
    "updatedAt": "2026-09-06T00:00:00.000Z"
  },
  "presentInCubes": [
    "titou_tribal"
  ],
  "objectiveAnalysis": {
    "summary": "Guide of Souls est une carte solide offrant un bon tempo et une flexibilité appréciable.",
    "roles": [
      "synergy_enabler"
    ],
    "floorRating": 3.7,
    "ceilingRating": 4.5,
    "tempoImpact": "medium",
    "quadrantStrengths": {
      "opening": 3.5,
      "developing": 4,
      "parity": 3.8,
      "behind": 3
    }
  },
  "cubeAnalyses": {
    "titou_tribal": {
      "cubeKey": "titou_tribal",
      "fit": "staple",
      "tier": "A+",
      "archetypes": [
        "titou:tribal_angels",
        "titou:tribal_humans"
      ],
      "synergyTags": [],
      "scoreModifier": 8,
      "analysis": "Carte de rang S (Score : 44.0) dans l'environnement tribal et interactif de Titou.",
      "pedagogy": {
        "howToPlay": "Menace ou ressource clé : déployez Guide of Souls dès que possible en sécurisant votre avantage.",
        "archetypeFit": [
          {
            "colors": [
              "W"
            ],
            "archetype": "TRIBAL SYNERGY",
            "grade": "S",
            "winrateOrScore": "Score 44.0",
            "comment": "Alignement au métagame Titou Tribal (S)."
          }
        ]
      },
      "relativeTier": "A+",
      "metaBonus": 8,
      "metaRole": "key"
    }
  },
  "frenchName": "Guide des âmes",
  "frenchText": "À chaque fois qu'une autre créature arrive sur le champ de bataille sous votre contrôle, vous gagnez 1 point de vie et {E} (un marqueur « énergie »).\nÀ chaque fois que vous attaquez, vous pouvez payer {E}{E}{E}. Quand vous faites ainsi, mettez deux marqueurs +1/+1 et un marqueur « vol » sur une créature attaquante ciblée. Elle devient un ange en plus de ses autres types.",
  "frenchImageUrl": "https://cards.scryfall.io/normal/front/e/8/e88ba353-52ca-4263-acf2-1944f88454f6.jpg?1782794125",
  "localFrenchPath": "data/cards/images/fr/cards/guide-of-souls.jpg"
}
