{
  "schemaVersion": 1,
  "slug": "llanowar-elves",
  "name": "Llanowar Elves",
  "oracleId": "68954295-54e3-4303-a6bc-fc4547a4e3a3",
  "manaCost": "oG",
  "cmc": 1,
  "colors": [
    "G"
  ],
  "colorIdentity": [
    "G"
  ],
  "typeLine": "Creature — Elf Druid",
  "types": [
    "Creature"
  ],
  "subtypes": [
    "Elf",
    "Druid"
  ],
  "oracleText": "{oT}: Add {oG}.",
  "keywords": [],
  "isLand": false,
  "producesColors": [
    "G"
  ],
  "image": {
    "url": "https://cards.scryfall.io/normal/front/6/a/6a0b230b-d391-4998-a3f7-7b158a0ec2cd.jpg?1783909057",
    "localPath": "data/cards/images/cards/llanowar-elves.jpg",
    "artCropUrl": "https://cards.scryfall.io/art_crop/front/6/a/6a0b230b-d391-4998-a3f7-7b158a0ec2cd.jpg?1783909057",
    "localArtPath": "data/cards/images/art/llanowar-elves.jpg",
    "localFrenchPath": "data/cards/images/fr/cards/llanowar-elves.jpg",
    "localFrenchArtPath": "data/cards/images/fr/art/llanowar-elves.jpg"
  },
  "imageUrl": "https://cards.scryfall.io/normal/front/6/a/6a0b230b-d391-4998-a3f7-7b158a0ec2cd.jpg?1783909057",
  "powerScore": {
    "score": 40,
    "source": "untapped",
    "rawSourceScore": 40,
    "harmonizationDegree": "native",
    "confidence": 1,
    "updatedAt": "2026-09-15T16:38:14.524Z"
  },
  "presentInCubes": [
    "titou_tribal",
    "nico_candyshop",
    "hugues_pauper",
    "cedric_cube"
  ],
  "objectiveAnalysis": {
    "summary": "Llanowar Elves est une carte de premier ordre offrant un bon tempo et une flexibilité appréciable.",
    "roles": [
      "bomb",
      "beater"
    ],
    "floorRating": 6.8,
    "ceilingRating": 7.7,
    "tempoImpact": "high",
    "quadrantStrengths": {
      "opening": 3.5,
      "developing": 4,
      "parity": 3.8,
      "behind": 3
    }
  },
  "cubeAnalyses": {
    "titou_tribal": {
      "cubeKey": "titou_tribal",
      "fit": "staple",
      "tier": "A",
      "archetypes": [
        "titou:tribal_elves"
      ],
      "synergyTags": [],
      "scoreModifier": 4,
      "analysis": "Carte de rang S (Score : 41.0) dans l'environnement tribal et interactif de Titou.",
      "pedagogy": {
        "howToPlay": "Menace ou ressource clé : déployez Llanowar Elves dès que possible en sécurisant votre avantage.",
        "archetypeFit": [
          {
            "colors": [
              "G"
            ],
            "archetype": "TRIBAL SYNERGY",
            "grade": "S",
            "winrateOrScore": "Score 41.0",
            "comment": "Alignement au métagame Titou Tribal (S)."
          }
        ]
      },
      "relativeTier": "A",
      "metaBonus": 4,
      "metaRole": "support"
    },
    "nico_candyshop": {
      "cubeKey": "nico_candyshop",
      "fit": "staple",
      "tier": "A-",
      "archetypes": [
        "nico:storm_combo",
        "nico:green_ramp"
      ],
      "synergyTags": [
        "has-identical-token",
        "token-versions-of-cards",
        "type-errata"
      ],
      "scoreModifier": 4,
      "analysis": "Sélectionné pour le Vintage Candyshop Cube de Fedor. Carte d'impact majeur sur le Tour Fondamental (T1-T3).",
      "pedagogy": {
        "howToPlay": "Prioriser sur courbe pour accélérer ou neutraliser les sorties explosives adverses.",
        "archetypeFit": [
          {
            "colors": [
              "G"
            ],
            "archetype": "STORM COMBO",
            "grade": "S",
            "winrateOrScore": "Score 41.0",
            "comment": "Alignement Vintage compétitif."
          }
        ]
      },
      "relativeTier": "A-",
      "metaBonus": 4,
      "metaRole": "support"
    },
    "hugues_pauper": {
      "cubeKey": "hugues_pauper",
      "fit": "staple",
      "tier": "A+",
      "archetypes": [
        "hugues:pauper_staple",
        "hugues:gruul_stompy",
        "hugues:selesnya_tokens",
        "hugues:simic_ramp_value"
      ],
      "synergyTags": [
        "has-identical-token",
        "token-versions-of-cards",
        "type-errata"
      ],
      "scoreModifier": 8,
      "analysis": "Sélectionné pour le Pauper Cube de Hugues. Pièce fondamentale valorisant le tempo et les échanges 2-pour-1 sur le Tour Pivot (T4-T5).",
      "pedagogy": {
        "howToPlay": "Optimiser les échanges de ressources et stabiliser la présence sur table vers le tour 4.",
        "archetypeFit": [
          {
            "colors": [
              "G"
            ],
            "archetype": "PAUPER STAPLE",
            "grade": "S",
            "winrateOrScore": "Score 41.0",
            "comment": "Pilier du métagame Pauper équilibré."
          }
        ]
      },
      "relativeTier": "A+",
      "metaBonus": 8,
      "metaRole": "key"
    },
    "cedric_cube": {
      "cubeKey": "cedric_cube",
      "fit": "staple",
      "tier": "A",
      "archetypes": [
        "cedric:simic_ramp_goodstuff",
        "cedric:gruul_stompy_sneak"
      ],
      "synergyTags": [
        "has-identical-token",
        "token-versions-of-cards",
        "type-errata"
      ],
      "scoreModifier": 4,
      "analysis": "Sélectionné pour le High-Power Cube de Cédric (Strobinellus). Carte d'impact majeur sur le Tour Pivot (T3.5 - T4).",
      "pedagogy": {
        "howToPlay": "Prioriser sur courbe pour développer des menaces résilientes ou interagir efficacement sur le tour 3-4.",
        "archetypeFit": [
          {
            "colors": [
              "G"
            ],
            "archetype": "SIMIC RAMP GOODSTUFF",
            "grade": "S",
            "winrateOrScore": "Score 41.0",
            "comment": "Pilier compétitif du cube de Cédric."
          }
        ]
      },
      "relativeTier": "A",
      "metaBonus": 4,
      "metaRole": "support"
    }
  },
  "frenchName": "Elfes de Llanowar",
  "frenchText": "{T} : Ajoutez {G}.",
  "frenchImageUrl": "https://cards.scryfall.io/normal/front/b/1/b164bd6d-260c-4f02-affe-fc774d433ae8.jpg?1782782845",
  "localFrenchPath": "data/cards/images/fr/cards/llanowar-elves.jpg"
}
