{
  "schemaVersion": 1,
  "slug": "dualcaster-mage",
  "name": "Dualcaster Mage",
  "oracleId": "8eb7c0a5-6190-40de-b473-2d1daa3bbe28",
  "manaCost": "{R}{R}{1}",
  "cmc": 3,
  "colors": [
    "R"
  ],
  "colorIdentity": [
    "R"
  ],
  "typeLine": "Creature — Human Wizard",
  "types": [
    "Creature"
  ],
  "subtypes": [
    "Human",
    "Wizard"
  ],
  "oracleText": "Flash\nWhen this creature enters, copy target instant or sorcery spell. You may choose new targets for the copy.",
  "keywords": [
    "Flash"
  ],
  "power": "2",
  "toughness": "2",
  "isLand": false,
  "producesColors": [],
  "image": {
    "url": "https://assets.cubecobra.com/cardimages/0b80c8a0-0870-4836-bee1-f4a805d119d6/normal.webp",
    "localPath": "data/cards/images/cards/dualcaster-mage.jpg",
    "artCropUrl": "https://assets.cubecobra.com/cardimages/0b80c8a0-0870-4836-bee1-f4a805d119d6/art_crop.webp",
    "localArtPath": "data/cards/images/art/dualcaster-mage.jpg"
  },
  "imageUrl": "https://assets.cubecobra.com/cardimages/0b80c8a0-0870-4836-bee1-f4a805d119d6/normal.webp",
  "powerScore": {
    "score": 20.1,
    "source": "expert_heuristic",
    "rawSourceScore": 20.1,
    "harmonizationDegree": "calibrated_medium",
    "confidence": 0.6,
    "updatedAt": "2026-09-06T00:00:00.000Z"
  },
  "presentInCubes": [
    "nico_candyshop",
    "cedric_cube"
  ],
  "objectiveAnalysis": {
    "summary": "Carte Vintage sélectionnée pour le Candyshop de Fedor (Score : 19.9).",
    "roles": [
      "engine"
    ],
    "floorRating": 3.1,
    "ceilingRating": 3.8,
    "tempoImpact": "medium",
    "quadrantStrengths": {
      "opening": 4,
      "developing": 4.2,
      "parity": 3.8,
      "behind": 3.5
    }
  },
  "cubeAnalyses": {
    "nico_candyshop": {
      "cubeKey": "nico_candyshop",
      "fit": "support",
      "tier": "D+",
      "archetypes": [],
      "synergyTags": [
        "copy-sorcery",
        "copy",
        "copy-instant"
      ],
      "scoreModifier": 0,
      "analysis": "Sélectionné pour le Vintage Candyshop Cube de Fedor. Carte d'impact majeur sur le Tour Fondamental (T1-T3).",
      "pedagogy": {
        "howToPlay": "Prioriser sur courbe pour accélérer ou neutraliser les sorties explosives adverses.",
        "archetypeFit": [
          {
            "colors": [
              "R"
            ],
            "archetype": "STORM COMBO",
            "grade": "B",
            "winrateOrScore": "Score 20.1",
            "comment": "Alignement Vintage compétitif."
          }
        ]
      },
      "relativeTier": "D+",
      "metaBonus": 0,
      "metaRole": "neutral"
    },
    "cedric_cube": {
      "cubeKey": "cedric_cube",
      "fit": "support",
      "tier": "C-",
      "archetypes": [],
      "synergyTags": [
        "copy-sorcery",
        "copy",
        "copy-instant"
      ],
      "scoreModifier": 0,
      "analysis": "Sélectionné pour le High-Power Cube de Cédric (Strobinellus). Carte d'impact majeur sur le Tour Pivot (T3.5 - T4).",
      "pedagogy": {
        "howToPlay": "Prioriser sur courbe pour développer des menaces résilientes ou interagir efficacement sur le tour 3-4.",
        "archetypeFit": [
          {
            "colors": [
              "R"
            ],
            "archetype": "IZZET SPELLS TEMPO",
            "grade": "B",
            "winrateOrScore": "Score 20.1",
            "comment": "Pilier compétitif du cube de Cédric."
          }
        ]
      },
      "relativeTier": "C-",
      "metaBonus": 0,
      "metaRole": "neutral"
    }
  }
}
