{
  "schemaVersion": 1,
  "slug": "brawn-amadeus-cho",
  "name": "Brawn, Amadeus Cho",
  "oracleId": "19910a90-d334-4d99-89f2-cd81cea3c824",
  "scryfallId": "813ef553-28f2-46d5-b14b-76ebcbe061d4",
  "manaCost": "{G-U}{1}",
  "cmc": 2,
  "colors": [
    "G",
    "U"
  ],
  "colorIdentity": [
    "G",
    "U"
  ],
  "typeLine": "Legendary Creature — Gamma Scientist Hero",
  "types": [
    "Legendary",
    "Creature"
  ],
  "subtypes": [
    "Gamma",
    "Scientist",
    "Hero"
  ],
  "oracleText": "When Brawn enters, draw a card.\nPower-up — {4}{G/U}: Put a +1/+1 counter on Brawn for each card in your hand. (Activate each power-up ability only once. Reduce the cost by his mana cost if he entered this turn.)",
  "keywords": [
    "Power-up"
  ],
  "power": "1",
  "toughness": "1",
  "isLand": false,
  "producesColors": [],
  "image": {
    "url": "https://assets.cubecobra.com/cardimages/813ef553-28f2-46d5-b14b-76ebcbe061d4/normal.webp",
    "localPath": "data/cards/images/brawn-amadeus-cho.jpg",
    "artCropUrl": "https://assets.cubecobra.com/cardimages/813ef553-28f2-46d5-b14b-76ebcbe061d4/art_crop.webp"
  },
  "imageUrl": "https://assets.cubecobra.com/cardimages/813ef553-28f2-46d5-b14b-76ebcbe061d4/normal.webp",
  "powerScore": {
    "score": 30.5,
    "source": "expert_heuristic",
    "rawSourceScore": 30.5,
    "harmonizationDegree": "fallback",
    "confidence": 0.5,
    "updatedAt": "2026-09-06T00:00:00.000Z"
  },
  "presentInCubes": [
    "titou_arena_peasant_plus"
  ],
  "objectiveAnalysis": {
    "summary": "Carte sélectionnée pour le Cube Titou Arena Peasant Plus (Score : 30.5).",
    "roles": [
      "card_advantage"
    ],
    "floorRating": 4.7,
    "ceilingRating": 5.8,
    "tempoImpact": "high",
    "quadrantStrengths": {
      "opening": 3.8,
      "developing": 4,
      "parity": 3.9,
      "behind": 3.4
    }
  },
  "cubeAnalyses": {
    "titou_arena_peasant_plus": {
      "cubeKey": "titou_arena_peasant_plus",
      "fit": "support",
      "tier": "B+",
      "archetypes": [
        "titou_peasant:simic_tempo_ramp"
      ],
      "synergyTags": [
        "cantrip",
        "pure-draw",
        "draw"
      ],
      "scoreModifier": 4,
      "analysis": "Sélectionné pour le Titou Arena Peasant Plus Cube. Carte d'impact majeur sur le Tour Pivot (T3-T4).",
      "pedagogy": {
        "howToPlay": "Prioriser sur courbe pour développer votre plan de jeu ou interagir efficacement au tour 3-4.",
        "archetypeFit": [
          {
            "colors": [
              "G",
              "U"
            ],
            "archetype": "SIMIC TEMPO RAMP",
            "grade": "A",
            "winrateOrScore": "Score 30.5",
            "comment": "Pièce de valeur pour l'environnement Titou Peasant Plus."
          }
        ]
      },
      "relativeTier": "B+",
      "metaBonus": 4,
      "metaRole": "support"
    }
  }
}
